{
  "date": "2026-08-22",
  "generated_at": "2026-10-23T09:45:00Z",
  "item_count": 4,
  "sections": [
    {
      "heading": "AI 安全相关",
      "item_ids": [
        "itm_04f88334eb46888a"
      ],
      "summary": "AI 安全相关 本次共有 1 条内容进入公开数据，详见对应 Markdown 深读稿。"
    },
    {
      "heading": "大模型 Agent 相关",
      "item_ids": [
        "itm_97f36cd2d53a57ad",
        "itm_6ebc4819a672d73f"
      ],
      "summary": "大模型 Agent 相关 本次共有 2 条内容进入公开数据，详见对应 Markdown 深读稿。"
    },
    {
      "heading": "大模型后训练相关",
      "item_ids": [
        "itm_ceb4afa34405a782"
      ],
      "summary": "大模型后训练相关 本次共有 1 条内容进入公开数据，详见对应 Markdown 深读稿。"
    }
  ],
  "source_counts": {
    "arxiv": 4
  },
  "summary": "2026-08-22 public data 已由 finalize-public-run 统一重建索引和报告，共 4 条内容。",
  "top_item_ids": [
    "itm_04f88334eb46888a",
    "itm_ceb4afa34405a782",
    "itm_97f36cd2d53a57ad",
    "itm_6ebc4819a672d73f"
  ],
  "version": 1
}
