{
  "date": "2026-06-17",
  "generated_at": "2026-10-14T14:39:17Z",
  "item_count": 4,
  "sections": [
    {
      "heading": "AI 安全相关",
      "item_ids": [
        "itm_f454d1511ae93479",
        "itm_ecb6b666753ea997"
      ],
      "summary": "AI 安全相关 本次共有 2 条内容进入公开数据，详见对应 Markdown 深读稿。"
    },
    {
      "heading": "大模型 Agent 相关",
      "item_ids": [
        "itm_b7c55fa783d2165e"
      ],
      "summary": "大模型 Agent 相关 本次共有 1 条内容进入公开数据，详见对应 Markdown 深读稿。"
    },
    {
      "heading": "大模型后训练相关",
      "item_ids": [
        "itm_0f0a03588843d1d7"
      ],
      "summary": "大模型后训练相关 本次共有 1 条内容进入公开数据，详见对应 Markdown 深读稿。"
    }
  ],
  "source_counts": {
    "arxiv": 4
  },
  "summary": "2026-06-17 public data 已由 finalize-public-run 统一重建索引和报告，共 4 条内容。",
  "top_item_ids": [
    "itm_f454d1511ae93479",
    "itm_b7c55fa783d2165e",
    "itm_ecb6b666753ea997",
    "itm_0f0a03588843d1d7"
  ],
  "version": 1
}
