{
  "date": "2026-07-11",
  "generated_at": "2026-10-17T03:11:45Z",
  "item_count": 6,
  "sections": [
    {
      "heading": "AI 安全相关",
      "item_ids": [
        "itm_264195592b884f44",
        "itm_cb2179f524b38720"
      ],
      "summary": "AI 安全相关 本次共有 2 条内容进入公开数据，详见对应 Markdown 深读稿。"
    },
    {
      "heading": "大模型 Agent 相关",
      "item_ids": [
        "itm_8b8c12ef930defff",
        "itm_b4f91dcdec1bcd14",
        "itm_47ea80cd7c121ed6"
      ],
      "summary": "大模型 Agent 相关 本次共有 3 条内容进入公开数据，详见对应 Markdown 深读稿。"
    },
    {
      "heading": "大模型后训练相关",
      "item_ids": [
        "itm_cfbb7976cb467f56"
      ],
      "summary": "大模型后训练相关 本次共有 1 条内容进入公开数据，详见对应 Markdown 深读稿。"
    }
  ],
  "source_counts": {
    "arxiv": 6
  },
  "summary": "2026-07-11 public data 已由 finalize-public-run 统一重建索引和报告，共 6 条内容。",
  "top_item_ids": [
    "itm_264195592b884f44",
    "itm_8b8c12ef930defff",
    "itm_b4f91dcdec1bcd14",
    "itm_cb2179f524b38720",
    "itm_47ea80cd7c121ed6"
  ],
  "version": 1
}
