{
  "date": "2026-06-15",
  "generated_at": "2026-10-22T22:31:49Z",
  "item_count": 7,
  "sections": [
    {
      "heading": "AI 安全相关",
      "item_ids": [
        "itm_bb538d585e53e4d2",
        "itm_8e89b94c54645a95"
      ],
      "summary": "AI 安全相关 本次共有 2 条内容进入公开数据，详见对应 Markdown 深读稿。"
    },
    {
      "heading": "大模型 Agent 相关",
      "item_ids": [
        "itm_362b64c9dd778491",
        "itm_589e9bc86fa57fc5",
        "itm_ba6fd381a65909bf",
        "itm_0001d2f9b6692d84",
        "itm_709a869ef8a06152"
      ],
      "summary": "大模型 Agent 相关 本次共有 5 条内容进入公开数据，详见对应 Markdown 深读稿。"
    }
  ],
  "source_counts": {
    "arxiv": 4,
    "arxiv-cs-ai": 1,
    "arxiv-cs-cr": 1,
    "github": 1
  },
  "summary": "2026-06-15 public data 已由 finalize-public-run 统一重建索引和报告，共 7 条内容。",
  "top_item_ids": [
    "itm_bb538d585e53e4d2",
    "itm_8e89b94c54645a95",
    "itm_362b64c9dd778491",
    "itm_589e9bc86fa57fc5",
    "itm_ba6fd381a65909bf"
  ],
  "version": 1
}
