{
  "date": "2026-10-16",
  "generated_at": "2026-10-20T02:55:18Z",
  "item_count": 7,
  "sections": [
    {
      "heading": "AI 安全相关",
      "item_ids": [
        "itm_b5c7c8ba813123b4",
        "itm_eabdba3d0ecd0e18"
      ],
      "summary": "AI 安全相关 本次共有 2 条内容进入公开数据，详见对应 Markdown 深读稿。"
    },
    {
      "heading": "大模型 Agent 相关",
      "item_ids": [
        "itm_a51e3c14f3ab4588",
        "itm_e47342c1f32a4cef",
        "itm_9a173d46c7216564"
      ],
      "summary": "大模型 Agent 相关 本次共有 3 条内容进入公开数据，详见对应 Markdown 深读稿。"
    },
    {
      "heading": "大模型后训练相关",
      "item_ids": [
        "itm_5217696b929d2edc",
        "itm_b828a308c17e39f5"
      ],
      "summary": "大模型后训练相关 本次共有 2 条内容进入公开数据，详见对应 Markdown 深读稿。"
    }
  ],
  "source_counts": {
    "arxiv": 5,
    "arxiv-2610-22019": 1,
    "arxiv-forgetting-2026": 1
  },
  "summary": "2026-10-16 public data 已由 finalize-public-run 统一重建索引和报告，共 7 条内容。",
  "top_item_ids": [
    "itm_5217696b929d2edc",
    "itm_b5c7c8ba813123b4",
    "itm_b828a308c17e39f5",
    "itm_a51e3c14f3ab4588",
    "itm_e47342c1f32a4cef"
  ],
  "version": 1
}
