{
  "date": "2026-07-21",
  "generated_at": "2026-10-23T09:45:00Z",
  "item_count": 7,
  "sections": [
    {
      "heading": "AI 安全相关",
      "item_ids": [
        "itm_1ec06fe1bd7c699a",
        "itm_f0c01e6783ee1c7e",
        "itm_cc8ede859230a69a"
      ],
      "summary": "AI 安全相关 本次共有 3 条内容进入公开数据，详见对应 Markdown 深读稿。"
    },
    {
      "heading": "大模型 Agent 相关",
      "item_ids": [
        "itm_f8ef91cb8fa23b29",
        "itm_98396b70139be2d5",
        "itm_df49ddfb7115e7ad"
      ],
      "summary": "大模型 Agent 相关 本次共有 3 条内容进入公开数据，详见对应 Markdown 深读稿。"
    },
    {
      "heading": "大模型后训练相关",
      "item_ids": [
        "itm_97206e158884c19c"
      ],
      "summary": "大模型后训练相关 本次共有 1 条内容进入公开数据，详见对应 Markdown 深读稿。"
    }
  ],
  "source_counts": {
    "arxiv": 7
  },
  "summary": "2026-07-21 public data 已由 finalize-public-run 统一重建索引和报告，共 7 条内容。",
  "top_item_ids": [
    "itm_1ec06fe1bd7c699a",
    "itm_97206e158884c19c",
    "itm_f8ef91cb8fa23b29",
    "itm_98396b70139be2d5",
    "itm_f0c01e6783ee1c7e"
  ],
  "version": 1
}
