{
  "date": "2026-10-23",
  "generated_at": "2026-10-28T00:00:00Z",
  "item_count": 1,
  "sections": [
    {
      "heading": "大模型 Agent 相关",
      "item_ids": [
        "itm_5fe8d089ae987bad"
      ],
      "summary": "大模型 Agent 相关 本次共有 1 条内容进入公开数据，详见对应 Markdown 深读稿。"
    }
  ],
  "source_counts": {
    "openai": 1
  },
  "summary": "2026-10-23 public data 已由 finalize-public-run 统一重建索引和报告，共 1 条内容。",
  "top_item_ids": [
    "itm_5fe8d089ae987bad"
  ],
  "version": 1
}
