{
  "date": "2026-07-22",
  "generated_at": "2026-10-16T21:08:36Z",
  "item_count": 6,
  "sections": [
    {
      "heading": "AI 安全相关",
      "item_ids": [
        "itm_707a25b1dc8eef2b",
        "itm_5d0782fb9515516d",
        "itm_187afc1febe2335b",
        "itm_a8c2a680fdfba2bf"
      ],
      "summary": "AI 安全相关 本次共有 4 条内容进入公开数据，详见对应 Markdown 深读稿。"
    },
    {
      "heading": "大模型 Agent 相关",
      "item_ids": [
        "itm_aead1422774aae94",
        "itm_0df6c63220aac1f3"
      ],
      "summary": "大模型 Agent 相关 本次共有 2 条内容进入公开数据，详见对应 Markdown 深读稿。"
    }
  ],
  "source_counts": {
    "arxiv": 6
  },
  "summary": "2026-07-22 public data 已由 finalize-public-run 统一重建索引和报告，共 6 条内容。",
  "top_item_ids": [
    "itm_707a25b1dc8eef2b",
    "itm_5d0782fb9515516d",
    "itm_aead1422774aae94",
    "itm_0df6c63220aac1f3",
    "itm_187afc1febe2335b"
  ],
  "version": 1
}
