{
  "date": "2026-07-12",
  "generated_at": "2026-10-20T21:23:17Z",
  "item_count": 2,
  "sections": [
    {
      "heading": "AI 安全相关",
      "item_ids": [
        "itm_0144380e5949acdb",
        "itm_2f5606aba23edada"
      ],
      "summary": "AI 安全相关 本次共有 2 条内容进入公开数据，详见对应 Markdown 深读稿。"
    }
  ],
  "source_counts": {
    "arxiv": 2
  },
  "summary": "2026-07-12 public data 已由 finalize-public-run 统一重建索引和报告，共 2 条内容。",
  "top_item_ids": [
    "itm_0144380e5949acdb",
    "itm_2f5606aba23edada"
  ],
  "version": 1
}
