{
  "date": "2026-10-15",
  "generated_at": "2026-10-21T16:39:30Z",
  "item_count": 4,
  "sections": [
    {
      "heading": "AI 安全相关",
      "item_ids": [
        "itm_afcb311863187516",
        "itm_1ae4079228cce30a",
        "itm_0f7dfcfdc1f9f405"
      ],
      "summary": "AI 安全相关 本次共有 3 条内容进入公开数据，详见对应 Markdown 深读稿。"
    },
    {
      "heading": "大模型后训练相关",
      "item_ids": [
        "itm_9b99dac7607853de"
      ],
      "summary": "大模型后训练相关 本次共有 1 条内容进入公开数据，详见对应 Markdown 深读稿。"
    }
  ],
  "source_counts": {
    "anthropic-research": 1,
    "arxiv": 3
  },
  "summary": "2026-10-15 public data 已由 finalize-public-run 统一重建索引和报告，共 4 条内容。",
  "top_item_ids": [
    "itm_afcb311863187516",
    "itm_9b99dac7607853de",
    "itm_1ae4079228cce30a",
    "itm_0f7dfcfdc1f9f405"
  ],
  "version": 1
}
