{
  "date": "2026-08-05",
  "generated_at": "2026-10-28T00:00:00Z",
  "item_count": 9,
  "sections": [
    {
      "heading": "AI 安全相关",
      "item_ids": [
        "itm_175f4cbcd288c60e",
        "itm_18cf0f42c09244f2",
        "itm_39271e5f297a3698",
        "itm_3bbbe04f52646e8f",
        "itm_0556e99c7d8a3aaf"
      ],
      "summary": "AI 安全相关 本次共有 5 条内容进入公开数据，详见对应 Markdown 深读稿。"
    },
    {
      "heading": "大模型 Agent 相关",
      "item_ids": [
        "itm_68741e165a1af49e",
        "itm_b427f898c5acbec3",
        "itm_32de362c1ebc47e3"
      ],
      "summary": "大模型 Agent 相关 本次共有 3 条内容进入公开数据，详见对应 Markdown 深读稿。"
    },
    {
      "heading": "大模型后训练相关",
      "item_ids": [
        "itm_90bd9bad92681015"
      ],
      "summary": "大模型后训练相关 本次共有 1 条内容进入公开数据，详见对应 Markdown 深读稿。"
    }
  ],
  "source_counts": {
    "aisi": 1,
    "arxiv": 6,
    "arxiv-mafia-memory-attacks": 1,
    "arxiv-s3-stage-specific-safety": 1
  },
  "summary": "2026-08-05 public data 已由 finalize-public-run 统一重建索引和报告，共 9 条内容。",
  "top_item_ids": [
    "itm_175f4cbcd288c60e",
    "itm_18cf0f42c09244f2",
    "itm_68741e165a1af49e",
    "itm_39271e5f297a3698",
    "itm_b427f898c5acbec3"
  ],
  "version": 1
}
