{
  "date": "2026-06-13",
  "generated_at": "2026-10-13T20:38:27Z",
  "item_count": 7,
  "sections": [
    {
      "heading": "AI 安全相关",
      "item_ids": [
        "itm_c766a64f8c8ea356",
        "itm_32e0bbfba1cac608"
      ],
      "summary": "AI 安全相关 本次共有 2 条内容进入公开数据，详见对应 Markdown 深读稿。"
    },
    {
      "heading": "大模型 Agent 相关",
      "item_ids": [
        "itm_e344330877878891",
        "itm_5c016e51784fe0cd",
        "itm_7de8f1ba7c1797cc",
        "itm_0190c5cfb0d85ed7"
      ],
      "summary": "大模型 Agent 相关 本次共有 4 条内容进入公开数据，详见对应 Markdown 深读稿。"
    },
    {
      "heading": "大模型后训练相关",
      "item_ids": [
        "itm_498300817c8d0516"
      ],
      "summary": "大模型后训练相关 本次共有 1 条内容进入公开数据，详见对应 Markdown 深读稿。"
    }
  ],
  "source_counts": {
    "arxiv": 6,
    "arxiv-cs-cr": 1
  },
  "summary": "2026-06-13 public data 已由 finalize-public-run 统一重建索引和报告，共 7 条内容。",
  "top_item_ids": [
    "itm_e344330877878891",
    "itm_5c016e51784fe0cd",
    "itm_c766a64f8c8ea356",
    "itm_498300817c8d0516",
    "itm_7de8f1ba7c1797cc"
  ],
  "version": 1
}
